Flower Color ,"Meaning"
"Red Flowers","Fresh red flowers send the clear and powerful message of intense romantic love. Red is the unquestioned color of passion and any red bouquet or red flower arrangement will communicate your strong and powerful love. Red flowers are the closest symbolic likeness to the heart. Red is the color of seduction and desire. Red roses are the most common red flower but red carnations red tulips and red gerbera daisies will all transmit your message of desire and passion."
"Orange Flowers","If one could capture and concentrate the sun the result would be bright luminous orange flowers. Orange flowers offer happiness and joy. To look upon a fresh orange flower bouquet is to immediately feel the warmth of love. Orange flowers also send the message of adventure. Imagine the feeling of waking up without any responsibilities on a beautiful and warm weekend day. The possibilities are endless. This offer of adventure and spontaneity is included with each radiant orange flower arrangement."
"Yellow Flowers","Yellow flowers represent friendship and filial love. Yellow flowers represent trust compassion and respect. For these reasons yellow flowers are a popular choice at the workplace to show appreciation for a job well done. Yellow flowers with their soft radiance also communicate sympathy. These gentle flowers show your warmth and compassion and renew ties of friendship even during difficult times. Yellow daffodils are great flowers for friends. Yellow lilacs and yellow chrysanthemums are beautiful thoughtful flowers."
"Green Flowers","Bright healthy green in an arrangement represents harmony with nature and good fortune. To go green is to live a life of balance and enjoyment which leads to resilience and a youthful outlook. Green flowers offer a brilliant compliment to purple flowers and a wonderful contrast to many other bright hues. Green flowers draw attention to the architectural beauty of flowers especially the calla lily. Green arrangements and bouquets represent health wellness and a promise for good fortune."
"Blue Flowers","Rich deep blues found in the beautiful hydrangea and the extraordinary iris offer serenity. Blue flowers have a calming effect. They cool the emotions and create a contemplative mood. Imagine the easy pace of lying on your back and watching clouds float across a brilliant blue sky. Consider too the bliss of staring out at the calm blue sea. Blue flowers also speak of intimacy and are perfect flowers for long-term couples who want to communicate their deep and abiding trust. The peace derived from blue flowers also makes them an appropriate sympathy or get well flower."
"Purple Flowers","Purple flowers have an enchanted other worldly quality to them. Their soft color gently pulses with mystery. Purple flowers symbolize charm grace elegance and refinement. Their ethereal qualities also represent creativity. Purple flowers can make a strong romantic impression. A beautiful Purple arrangement can also symbolize an important transition. Purple flowers are some of the most beautiful flowers in the world. You are sure to send an extraordinary message with a gorgeous Purple bouquet."
"White Flowers","Fresh white flowers are most closely associated with purity and innocence. The delicate white blossoms represent honesty purity and perfection. White flowers are ideal when you are looking to communicate that wonderful combination of elegance and innocence. For many white roses are the perfect bridal flower. Other gorgeous and powerful white flowers include white carnations white orchids white calla lilies and white daisies. These flowers all communicate pure thoughtful love and undying fidelity."